,title,url,thumbnail_url,channel,description
0,CHAPTER 3 MEMES (best season),https://www.youtube.com/watch?v=bYvszk5UHxE,https://i.ytimg.com/vi/bYvszk5UHxE/hqdefault.jpg?sqp=-oaymwEcCPYBEIoBSFXyq4qpAw4IARUAAIhCGAFwAcABBg==&rs=AOn4CLAFQMKDKXLJXWOzZe2afqnDuBWQXQ,LazarBeam,Is fortnite back? is chapter 3 good? does lazarbeam win?? 👕LAZAR Merch - https://shoplazar.com/ 🎥SECOND CHANNEL - https://www.youtube.com/user/CrushSlash 🩳LAZAR SHORTS - https://www.youtub...
1,The Matrix Resurrections – Official Trailer 2,https://www.youtube.com/watch?v=nNpvWBuTfrc,https://i.ytimg.com/vi/nNpvWBuTfrc/hqdefault.jpg?sqp=-oaymwEcCPYBEIoBSFXyq4qpAw4IARUAAIhCGAFwAcABBg==&rs=AOn4CLAbNa7U6VhaHyEsPugXtANaRNhVvA,Warner Bros. Pictures,Remember what is real. Watch the new trailer for The Matrix Resurrections now – in theaters and on HBO Max 12.22.21. Get tickets: https://gettickets.whatisthematrix.com #MatrixMonday #TheMatrix...
2,"Davis vs Cruz HIGHLIGHTS: December 15, 2021 | PBC on Showtime PPV",https://www.youtube.com/watch?v=7bbyfAsSlho,https://i.ytimg.com/vi/7bbyfAsSlho/hqdefault.jpg?sqp=-oaymwEcCPYBEIoBSFXyq4qpAw4IARUAAIhCGAFwAcABBg==&rs=AOn4CLAj9-dYNcqkOLyU2dSiVUj6yt5HUw,Premier Boxing Champions,"Boxing superstar and five-time world champion Gervonta “Tank” Davis put his boxing skills on display, winning a rousing 12-round round unanimous decision over the relentless Isaac “Pitbull”..."
3,Nick Eh 30 reacts to Fortnite Chapter 3 GAMEPLAY!,https://www.youtube.com/watch?v=40SlM2Sh8OU,,Nick Eh 30,• 0:00 New Fortnite Chapter 3 Intro/Cinematic • 2:36 Reacting to Chapter 3 Trailers • 3:13 Game #1 of Chapter 3 • 3:26 Chapter 3 Map • 4:03 Sliding • 4:17 First Person (MK-7 AR)...
4,"Gervonta Davis Calls Haney, Garcia, Kambosos 'Easy Work' & Says He Is The 'Top Dog' | SHOWTIME PPV",https://www.youtube.com/watch?v=pTOpSs0f9Vw,,SHOWTIME Sports,"Boxing’s hottest attraction Gervonta “Tank” Davis defended his lightweight championship with a tough UD win over Isaac Cruz in an explosive showdown. After his win, Davis spoke with..."
5,Snack Video Games: Last Week Tonight with John Oliver (Web Exclusive),https://www.youtube.com/watch?v=8Kfx2fANELo,,LastWeekTonight,"John Oliver explores the lost world of snack-sponsored video games, and pitches some ideas to today’s snack brands. Connect with Last Week Tonight online... Subscribe to the Last Week..."
6,Billie Eilish - Male Fantasy (Official Music Video),https://www.youtube.com/watch?v=G_BhUxx-cwk,,Billie Eilish,"Listen to the sophomore album “Happier Than Ever”, out now: https://BillieEilish.lnk.to/HappierThanEver Directed and edited by Billie Eilish Follow Billie Eilish: Facebook: https://BillieE..."
7,The Matrix Awakens: An Unreal Engine 5 Experience | Teaser,https://www.youtube.com/watch?v=tV7BRjFzKH8,,Unreal Engine,Watch the teaser for 'The Matrix Awakens: An Unreal Engine 5 Experience' here! Get ready for a glimpse into the future of interactive storytelling and entertainment with UE5. Created by...
8,Harry Potter 20th Anniversary: Return to Hogwarts | First Look Teaser | HBO Max,https://www.youtube.com/watch?v=X2RzASP6cbA,,HBO Max,"The invitation you've been waiting for has arrived. Harry Potter 20th Anniversary: Return to Hogwarts is coming to HBO Max on New Year's Day. Daniel Radcliffe, Rupert Grint and Emma Watson..."
9,Grizzy REACTS to memes that cure sleep deprivation,https://www.youtube.com/watch?v=7715OMFyqtA,,GrizzyTV,WATCH ME LIVE ► https://www.twitch.tv/Grizzy follow me on Twitter ►https://www.twitter.com/sogrizzy follow me on Instagram ► https://www.instagram.com/sogrizzy Hope you enjoyed the video!...
